{
  "$schema": "https://json-schema.org/draft/2020-12/schema",
  "$id": "https://openjade.de/oddc/schemas/evidence.schema.json",
  "title": "ODDC validation evidence",
  "type": "object",
  "required": [
    "schemaVersion",
    "id",
    "deviceId",
    "observedAt",
    "status",
    "results"
  ],
  "properties": {
    "$schema": {
      "type": "string"
    },
    "schemaVersion": {
      "const": "2.0.0"
    },
    "id": {
      "type": "string",
      "minLength": 1,
      "pattern": "^[a-z0-9]+(?:[-/][a-z0-9]+)*$"
    },
    "deviceId": {
      "type": "string",
      "minLength": 1,
      "pattern": "^[a-z0-9](?:[a-z0-9-]*[a-z0-9])?(?:/[a-z0-9](?:[a-z0-9-]*[a-z0-9])?)*$"
    },
    "observedAt": {
      "type": "string",
      "pattern": "^[0-9]{4}-[0-9]{2}-[0-9]{2}$"
    },
    "status": {
      "enum": [
        "documented",
        "detected",
        "configured",
        "runtime-verified",
        "hardware-validated"
      ]
    },
    "environment": {
      "type": "object"
    },
    "results": {
      "type": "object",
      "propertyNames": {
        "pattern": "^[A-Za-z0-9][A-Za-z0-9._-]*$"
      },
      "additionalProperties": {
        "type": "string",
        "pattern": "^[a-z0-9][a-z0-9.-]{0,31}$"
      }
    },
    "drivers": {
      "description": "Kernel drivers bound to the model's components that were present, by component ID.",
      "type": "object",
      "propertyNames": {
        "pattern": "^[a-z0-9](?:[a-z0-9-]*[a-z0-9])?(?:/[a-z0-9](?:[a-z0-9-]*[a-z0-9])?)*$"
      },
      "additionalProperties": {
        "type": "array",
        "minItems": 1,
        "items": {
          "type": "string",
          "pattern": "^[A-Za-z0-9][A-Za-z0-9_.-]{0,63}$"
        }
      }
    },
    "closure": {
      "description": "Digest of the deployed model's resolved catalog data the record was made on.",
      "type": "string",
      "pattern": "^sha256:[0-9a-f]{64}$"
    },
    "inactiveQuirks": {
      "description": "The model's kernel-ranged quirks the deployment did not apply, by key.",
      "type": "array",
      "uniqueItems": true,
      "items": {
        "type": "string",
        "pattern": "^[A-Za-z][A-Za-z0-9]*$"
      }
    }
  },
  "additionalProperties": false
}
