{
  "$schema": "../../../../schemas/evidence.schema.json",
  "schemaVersion": "2.0.0",
  "id": "zbook-x2-g4-2026-10-12",
  "deviceId": "model/hp/zbook-x2-g4",
  "observedAt": "2026-10-12",
  "status": "hardware-validated",
  "environment": {
    "bios": "P72 Ver. 01.53",
    "kernel": "7.2.2",
    "oddc": "85814deca4518f01ddd0c644d158ff12b6c7e16d",
    "os": "NixOS 26.05"
  },
  "results": {
    "capabilities.chargeThresholds": "not-exposed",
    "capabilities.kickstandSwitch": "pass",
    "capabilities.tabletModeSwitch": "not-exposed",
    "hardware.audio.controller": "pass",
    "hardware.camera.front": "pass",
    "hardware.camera.rear": "pass",
    "hardware.display.internal.primary": "pass",
    "hardware.graphics.discrete": "pass",
    "hardware.input.keyboard.primary": "pass",
    "hardware.input.pen.primary": "pass",
    "hardware.input.quickKeys.primary": "pass",
    "hardware.input.touchscreen.primary": "pass",
    "hardware.network.bluetooth.primary": "pass",
    "hardware.network.wifi.primary": "pass",
    "hardware.security.fingerprint.primary": "unsupported",
    "hardware.sensors.hub": "pass",
    "hardware.storage.cardReader.primary": "pass",
    "hardware.usb.controller": "pass",
    "hardware.usbC.thunderbolt": "pass",
    "identity": "pass",
    "policy.graphics": "pass",
    "policy.input": "pass",
    "policy.kernel": "pass",
    "policy.thermal": "pass",
    "quirks.pchPmeGpe69Storm": "pass"
  },
  "drivers": {
    "audio/intel/sunrise-point-lp-hda": [
      "snd_hda_intel"
    ],
    "bluetooth/intel/0a2b": [
      "btusb"
    ],
    "camera/chicony/b5e7": [
      "uvcvideo"
    ],
    "camera/realtek/5666": [
      "uvcvideo"
    ],
    "cardreader/realtek/rts522a": [
      "rtsx_pci"
    ],
    "graphics/nvidia/quadro-m620": [
      "nvidia"
    ],
    "keyboard/nxp/1fc9-0088": [
      "hid-generic"
    ],
    "pen/wacom/056a-016c": [
      "wacom"
    ],
    "quickkeys/hp/03f0-0a56": [
      "hid-generic"
    ],
    "sensorhub/intel/sunrise-point-lp-ish": [
      "intel_ish_ipc"
    ],
    "thunderbolt/intel/jhl6540": [
      "xhci_hcd"
    ],
    "touchscreen/03eb-8abb": [
      "hid-multitouch"
    ],
    "usbcontroller/intel/sunrise-point-lp-xhci": [
      "xhci_hcd"
    ],
    "wifi/intel/8265": [
      "iwlwifi"
    ]
  },
  "closure": "sha256:3d53a22e596e84ae82c1069ab8b36d4ba06d0dc1f5361ecce69a6fe6896f260b"
}
